{
  "generatedAt": "2026-10-16T14:43:54+09:00",
  "adapters": {
    "blog-irisblossomlife": {
      "type": "rss",
      "adapter": "OK",
      "code": null,
      "items": 50,
      "status": "STALE",
      "lastSuccessAt": "2026-10-16T14:43:54+09:00",
      "lastFailureAt": null,
      "failureCount": 0,
      "newestItemAt": "2024-10-07T08:00:48+09:00"
    },
    "blog-koreanbapsang": {
      "type": "rss",
      "adapter": "OK",
      "code": null,
      "items": 10,
      "status": "STALE",
      "lastSuccessAt": "2026-10-16T14:43:54+09:00",
      "lastFailureAt": null,
      "failureCount": 0,
      "newestItemAt": "2025-03-22T02:34:09+09:00"
    },
    "blog-mykoreankitchen": {
      "type": "rss",
      "adapter": "OK",
      "code": null,
      "items": 25,
      "status": "ACTIVE",
      "lastSuccessAt": "2026-10-16T14:43:54+09:00",
      "lastFailureAt": null,
      "failureCount": 0,
      "newestItemAt": "2026-09-26T19:00:22+09:00"
    },
    "blog-beyondkimchee": {
      "type": "rss",
      "adapter": "OK",
      "code": null,
      "items": 50,
      "status": "ACTIVE",
      "lastSuccessAt": "2026-10-16T14:43:54+09:00",
      "lastFailureAt": null,
      "failureCount": 0,
      "newestItemAt": "2026-10-06T21:07:00+09:00"
    },
    "blog-seonkyounglongest": {
      "type": "rss",
      "adapter": "OK",
      "code": null,
      "items": 25,
      "status": "ACTIVE",
      "lastSuccessAt": "2026-10-16T14:43:54+09:00",
      "lastFailureAt": null,
      "failureCount": 0,
      "newestItemAt": "2026-09-10T16:04:04+09:00"
    },
    "blog-budgetbytes": {
      "type": "rss",
      "adapter": "OK",
      "code": null,
      "items": 50,
      "status": "ACTIVE",
      "lastSuccessAt": "2026-10-16T14:43:54+09:00",
      "lastFailureAt": null,
      "failureCount": 0,
      "newestItemAt": "2026-10-14T22:30:00+09:00"
    },
    "blog-justonecookbook": {
      "type": "rss",
      "adapter": "OK",
      "code": null,
      "items": 40,
      "status": "ACTIVE",
      "lastSuccessAt": "2026-10-16T14:43:54+09:00",
      "lastFailureAt": null,
      "failureCount": 0,
      "newestItemAt": "2026-10-12T21:00:00+09:00"
    },
    "blog-cultureagora": {
      "type": "rss",
      "adapter": "OK",
      "code": null,
      "items": 10,
      "status": "ACTIVE",
      "lastSuccessAt": "2026-10-16T14:43:54+09:00",
      "lastFailureAt": null,
      "failureCount": 0,
      "newestItemAt": "2026-10-16T08:30:50+09:00"
    },
    "blog-twins0807": {
      "type": "rss",
      "adapter": "OK",
      "code": null,
      "items": 10,
      "status": "ACTIVE",
      "lastSuccessAt": "2026-10-16T14:43:54+09:00",
      "lastFailureAt": null,
      "failureCount": 0,
      "newestItemAt": "2026-10-15T19:55:03+09:00"
    },
    "blog-seon1982": {
      "type": "rss",
      "adapter": "OK",
      "code": null,
      "items": 5,
      "status": "ACTIVE",
      "lastSuccessAt": "2026-10-16T14:43:54+09:00",
      "lastFailureAt": null,
      "failureCount": 0,
      "newestItemAt": "2026-10-16T00:00:47+09:00"
    },
    "blog-dalsoonlife": {
      "type": "rss",
      "adapter": "OK",
      "code": null,
      "items": 15,
      "status": "ACTIVE",
      "lastSuccessAt": "2026-10-16T14:43:54+09:00",
      "lastFailureAt": null,
      "failureCount": 0,
      "newestItemAt": "2026-10-15T10:42:36+09:00"
    },
    "blog-heysukim114": {
      "type": "rss",
      "adapter": "OK",
      "code": null,
      "items": 50,
      "status": "ACTIVE",
      "lastSuccessAt": "2026-10-16T14:43:54+09:00",
      "lastFailureAt": null,
      "failureCount": 0,
      "newestItemAt": "2026-10-16T13:00:22+09:00"
    },
    "news-thinkfood": {
      "type": "rss",
      "adapter": "OK",
      "code": null,
      "items": 50,
      "status": "ACTIVE",
      "lastSuccessAt": "2026-10-16T14:43:54+09:00",
      "lastFailureAt": null,
      "failureCount": 0,
      "newestItemAt": "2026-10-16T11:33:21+09:00"
    },
    "news-foodnews": {
      "type": "rss",
      "adapter": "OK",
      "code": null,
      "items": 50,
      "status": "ACTIVE",
      "lastSuccessAt": "2026-10-16T14:43:54+09:00",
      "lastFailureAt": null,
      "failureCount": 0,
      "newestItemAt": "2026-10-16T20:34:38+09:00"
    },
    "news-foodbank": {
      "type": "rss",
      "adapter": "OK",
      "code": null,
      "items": 50,
      "status": "ACTIVE",
      "lastSuccessAt": "2026-10-16T14:43:54+09:00",
      "lastFailureAt": null,
      "failureCount": 0,
      "newestItemAt": "2026-10-16T03:45:47+09:00"
    },
    "news-fsnews": {
      "type": "rss",
      "adapter": "OK",
      "code": null,
      "items": 50,
      "status": "ACTIVE",
      "lastSuccessAt": "2026-10-16T14:43:54+09:00",
      "lastFailureAt": null,
      "failureCount": 0,
      "newestItemAt": "2026-10-16T18:48:42+09:00"
    },
    "news-yna-industry": {
      "type": "rss",
      "adapter": "DISABLED",
      "code": null,
      "items": 0,
      "status": "DISABLED",
      "lastSuccessAt": "2026-10-12T15:44:20+09:00",
      "lastFailureAt": null,
      "failureCount": 0,
      "newestItemAt": "2026-10-12T15:37:50+09:00"
    },
    "news-yna-health": {
      "type": "rss",
      "adapter": "DISABLED",
      "code": null,
      "items": 0,
      "status": "DISABLED",
      "lastSuccessAt": "2026-10-12T15:44:20+09:00",
      "lastFailureAt": null,
      "failureCount": 0,
      "newestItemAt": "2026-10-12T14:59:14+09:00"
    },
    "news-kormedi": {
      "type": "rss",
      "adapter": "OK",
      "code": null,
      "items": 50,
      "status": "ACTIVE",
      "lastSuccessAt": "2026-10-16T14:43:54+09:00",
      "lastFailureAt": null,
      "failureCount": 0,
      "newestItemAt": "2026-10-16T14:38:52+09:00"
    },
    "news-newsis-health": {
      "type": "rss",
      "adapter": "OK",
      "code": null,
      "items": 100,
      "status": "ACTIVE",
      "lastSuccessAt": "2026-10-16T14:43:54+09:00",
      "lastFailureAt": null,
      "failureCount": 0,
      "newestItemAt": "2026-10-16T14:41:48+09:00"
    },
    "news-donga-health": {
      "type": "rss",
      "adapter": "DISABLED",
      "code": null,
      "items": 0,
      "status": "DISABLED",
      "lastSuccessAt": "2026-10-12T15:44:20+09:00",
      "lastFailureAt": null,
      "failureCount": 0,
      "newestItemAt": "2026-10-12T15:06:29+09:00"
    },
    "news-seoul-life": {
      "type": "rss",
      "adapter": "DISABLED",
      "code": null,
      "items": 0,
      "status": "DISABLED",
      "lastSuccessAt": "2026-10-12T15:44:20+09:00",
      "lastFailureAt": null,
      "failureCount": 0,
      "newestItemAt": "2026-10-12T15:26:28+09:00"
    },
    "news-hidoc-healthylife": {
      "type": "rss",
      "adapter": "OK",
      "code": null,
      "items": 20,
      "status": "ACTIVE",
      "lastSuccessAt": "2026-10-16T14:43:54+09:00",
      "lastFailureAt": null,
      "failureCount": 0,
      "newestItemAt": "2026-10-16T16:00:00+09:00"
    },
    "news-ikunkang-life": {
      "type": "rss",
      "adapter": "OK",
      "code": null,
      "items": 20,
      "status": "ACTIVE",
      "lastSuccessAt": "2026-10-16T14:43:54+09:00",
      "lastFailureAt": null,
      "failureCount": 0,
      "newestItemAt": "2026-10-12T17:00:00+09:00"
    },
    "news-healthchosun": {
      "type": "rss",
      "adapter": "OK",
      "code": null,
      "items": 50,
      "status": "ACTIVE",
      "lastSuccessAt": "2026-10-16T14:43:54+09:00",
      "lastFailureAt": null,
      "failureCount": 0,
      "newestItemAt": "2026-10-16T14:30:00+09:00"
    },
    "news-ladykhan-living": {
      "type": "rss",
      "adapter": "DISABLED",
      "code": null,
      "items": 0,
      "status": "DISABLED",
      "lastSuccessAt": "2026-10-12T15:44:20+09:00",
      "lastFailureAt": null,
      "failureCount": 0,
      "newestItemAt": "2026-10-12T15:41:00+09:00"
    },
    "news-ladykhan-wellness": {
      "type": "rss",
      "adapter": "DISABLED",
      "code": null,
      "items": 0,
      "status": "DISABLED",
      "lastSuccessAt": "2026-10-12T15:44:20+09:00",
      "lastFailureAt": null,
      "failureCount": 0,
      "newestItemAt": "2026-10-12T15:23:00+09:00"
    },
    "news-foodicon": {
      "type": "rss",
      "adapter": "OK",
      "code": null,
      "items": 50,
      "status": "ACTIVE",
      "lastSuccessAt": "2026-10-16T14:43:54+09:00",
      "lastFailureAt": null,
      "failureCount": 0,
      "newestItemAt": "2026-10-16T22:52:10+09:00"
    },
    "web-exa-trend": {
      "type": "web_search",
      "adapter": "OK",
      "code": null,
      "items": 43,
      "status": "ACTIVE",
      "lastSuccessAt": "2026-10-16T14:43:54+09:00",
      "lastFailureAt": "2026-09-29T15:15:07+09:00",
      "failureCount": 0,
      "newestItemAt": "2026-10-16T12:00:00+09:00"
    },
    "web-exa-habit": {
      "type": "web_search",
      "adapter": "OK",
      "code": null,
      "items": 52,
      "status": "ACTIVE",
      "lastSuccessAt": "2026-10-16T14:43:54+09:00",
      "lastFailureAt": "2026-09-29T15:15:07+09:00",
      "failureCount": 0,
      "newestItemAt": "2026-10-15T08:18:42+09:00"
    },
    "web-naver-trend": {
      "type": "web_search",
      "adapter": "DISABLED",
      "code": null,
      "items": 0,
      "status": "DISABLED",
      "lastSuccessAt": "2026-10-11T15:36:58+09:00",
      "lastFailureAt": "2026-09-29T15:15:07+09:00",
      "failureCount": 0,
      "newestItemAt": "2026-10-04T15:50:10+09:00"
    },
    "yt-search": {
      "type": "youtube_search",
      "adapter": "DISABLED",
      "code": null,
      "items": 0,
      "status": "DISABLED",
      "lastSuccessAt": "2026-10-01T15:40:29+09:00",
      "lastFailureAt": "2026-10-12T15:44:20+09:00",
      "failureCount": 11,
      "newestItemAt": "2026-09-25T00:00:00+09:00"
    },
    "yt-jachwiyorisin": {
      "type": "youtube_channel",
      "adapter": "OK",
      "code": null,
      "items": 6,
      "status": "ACTIVE",
      "lastSuccessAt": "2026-10-16T14:43:54+09:00",